{
  "id": "garden_bonsai_collection",
  "name": "Bonsai collection",
  "kind": "exterior",
  "description": "Grid of flower pots topped with oak leaves — bonsai display.",
  "typical_dimensions": {
    "min": [
      5,
      3,
      5
    ],
    "preferred": [
      9,
      5,
      9
    ],
    "max": [
      20,
      8,
      20
    ]
  },
  "tags": {
    "category": "any",
    "style": [
      "medieval",
      "rustic",
      "fantasy",
      "gothic",
      "renaissance",
      "modern",
      "minimalist",
      "japanese",
      "chinese",
      "mediterranean"
    ]
  },
  "python_skill_signature": "pipeline.skills.garden_bonsai_collection.build(aabb: AABB, materials: Materials, style: str, **kwargs) -> list[Op]",
  "skill_category": "exterior_feature",
  "schema_version": "2.0",
  "style_affinity": "East-Asian (Japanese/Chinese) motif. Coherent in japanese/chinese (and fantasy). Out of place in Western, Gothic, Renaissance, Modern, Mediterranean buildings — use only if the building is East-Asian."
}
