{
  "id": "hip_roof",
  "name": "Hip roof",
  "kind": "structural",
  "description": "Pyramidal four-pitch roof (tejado a cuatro aguas). All four sides slope inward and converge at a single apex, giving uniform overhangs on every facade. Each ascending layer shrinks by one cell on every side; the outer ring uses stairs blocks facing inward and the inner area is filled with roofing material.",
  "typical_dimensions": {
    "min": [
      4,
      2,
      4
    ],
    "preferred": [
      8,
      4,
      8
    ],
    "max": [
      14,
      7,
      14
    ]
  },
  "required_furniture": [
    {
      "item": "roof_block",
      "count": "4..120",
      "rule": "Fill inner area of each shrinking layer."
    },
    {
      "item": "stairs_facing_north",
      "count": "1..14",
      "rule": "Outer ring on the south side of every layer."
    },
    {
      "item": "stairs_facing_south",
      "count": "1..14",
      "rule": "Outer ring on the north side of every layer."
    },
    {
      "item": "stairs_facing_east",
      "count": "1..14",
      "rule": "Outer ring on the west side of every layer."
    },
    {
      "item": "stairs_facing_west",
      "count": "1..14",
      "rule": "Outer ring on the west side of every layer."
    },
    {
      "item": "apex",
      "count": 1,
      "rule": "Single solid block (or chimney top) at the convergence point."
    }
  ],
  "placement_rules": [
    "Roof footprint must equal the underlying structure footprint.",
    "The base layer of the roof sits at y = aabb.y1 (immediately above the top of the wall AABB); the roof EXTENDS BEYOND the AABB.y1 top.",
    "Hip needs both horizontal dimensions comparable; works best when |W - D| ≤ 2.",
    "Each layer y above the base shrinks by 1 on ALL four sides.",
    "Four pitches converge at apex.",
    "Stairs face inward at each side (north→south, south→north, west→east, east→west).",
    "Total roof height equals floor(min(W, D) / 2)+1 levels including the apex.",
    "On footprints ≥ 8×8 the apex may carry a small chimney top (accent + lantern)."
  ],
  "lighting_ventilation": "Solid hip roofs do not require windows; ventilation is delegated to the dormer or chimney skills that may pierce this roof.",
  "style_variants": {
    "medieval": {
      "palette_overrides": {
        "roof": "minecraft:dark_oak_planks",
        "stairs": "minecraft:oak_stairs"
      },
      "notes": "Steep, dark wood pitches typical of half-timbered manors."
    },
    "modern": {
      "palette_overrides": {
        "roof": "minecraft:smooth_stone_slab",
        "stairs": "minecraft:smooth_quartz_stairs"
      },
      "notes": "Shallower visual feel via smooth-stone stairs; lantern apex omitted in minimalist variants."
    },
    "fantasy": {
      "palette_overrides": {
        "roof": "minecraft:purpur_block",
        "stairs": "minecraft:dark_oak_stairs"
      },
      "notes": "Exaggerated pitch with glowing apex (sea lantern) for tower caps."
    }
  },
  "alexander_patterns_relevant": [
    "sheltering-roof"
  ],
  "examples": [],
  "tags": {
    "category": "roof",
    "style": [
      "medieval",
      "modern",
      "fantasy",
      "victorian",
      "rustic"
    ]
  },
  "python_skill_signature": "pipeline.skills.hip_roof.build(aabb, materials, style, **kwargs) -> list[Op]",
  "skill_category": "global_silhouette",
  "schema_version": "2.0"
}
