{
  "id": "split-flight-stair",
  "name": "Split-flight imperial stair",
  "kind": "structural",
  "schema_version": "2.0",
  "skill_category": "connector_template",
  "description": "Imperial staircase in which a single broad lower flight rises along the central axis to a half-height landing where it splits into two narrower flights climbing in opposite directions to the upper storey. The wide first flight, four to six blocks across, invites a crowd to ascend together; the half-landing acts as a stage facing the room below; the upper flights, each two or three blocks wide, hug the side walls and arrive at symmetric balconies that frame whatever lies on the far wall. This Y-shaped figure was codified in Renaissance and Baroque palaces and reappears in opera-house lobbies, civic buildings, and grand chateaus, where its strong ceremonial axis turns the stair itself into the room's main event.",
  "typical_dimensions": {
    "min": [6, 5, 8],
    "preferred": [8, 7, 10],
    "max": [12, 9, 14]
  },
  "tags": {
    "category": "staircase",
    "style": ["renaissance", "gothic", "victorian"]
  },
  "applicable_to": ["monument", "residential", "castle"],
  "parameters": {
    "flight_count": 3,
    "lower_flight_width": "4_to_6",
    "upper_flights_width": "2_to_3",
    "landing_at": "half_height_central",
    "split_direction": "opposite_sides",
    "ceremonial_role": true
  },
  "alexander_patterns_relevant": [
    "main-entrance",
    "stair-seats"
  ],
  "python_skill_signature": null
}
