{
  "id": "balcony_railing",
  "name": "Interior balcony railing",
  "kind": "decorative",
  "description": "Low fence railing along the room perimeter — balcony or mezzanine edge.",
  "typical_dimensions": {
    "min": [
      4,
      3,
      4
    ],
    "preferred": [
      8,
      4,
      8
    ],
    "max": [
      16,
      9,
      16
    ]
  },
  "tags": {
    "category": "any",
    "style": [
      "medieval",
      "rustic",
      "fantasy",
      "gothic",
      "renaissance",
      "modern",
      "minimalist",
      "japanese",
      "chinese",
      "mediterranean"
    ]
  },
  "python_skill_signature": "pipeline.skills.balcony_railing.build(aabb: AABB, materials: Materials, style: str, **kwargs) -> list[Op]",
  "skill_category": "room_decoration",
  "schema_version": "2.0"
}
