{
  "id": "roof_ridge_band",
  "name": "Roof ridge accent band",
  "kind": "decorative",
  "description": "Accent line of @accent along the longer roof ridge.",
  "typical_dimensions": {
    "min": [
      3,
      2,
      3
    ],
    "preferred": [
      6,
      3,
      6
    ],
    "max": [
      12,
      5,
      12
    ]
  },
  "tags": {
    "category": "any",
    "style": [
      "medieval",
      "rustic",
      "fantasy",
      "gothic",
      "renaissance",
      "modern",
      "minimalist",
      "japanese",
      "chinese",
      "mediterranean"
    ]
  },
  "python_skill_signature": "pipeline.skills.roof_ridge_band.build(aabb: AABB, materials: Materials, style: str, **kwargs) -> list[Op]",
  "skill_category": "exterior_feature",
  "schema_version": "2.0"
}
