{
  "id": "music_room",
  "name": "Music room",
  "kind": "room",
  "description": "Intimate recital chamber organised around a single instrument against one wall, with a small audience of stair-seats facing it across a carpet rug. Floor in @floor, walls in @primary, low beamed lintel ceiling for acoustic enclosure. A 3-block @primary bench against the back wall carries 3-4 minecraft:note_block units (the 'piano'); one minecraft:jukebox flanks it for recorded music. A minecraft:bookshelf holds sheet music, two minecraft:lantern provide soft light, and a minecraft:flower_pot adds a decorative touch near the door.",
  "typical_dimensions": {
    "min": [
      6,
      4,
      6
    ],
    "preferred": [
      9,
      5,
      9
    ],
    "max": [
      12,
      5,
      12
    ]
  },
  "required_furniture": [
    {
      "item": "instrument_bench",
      "count": 1,
      "rule": "Row of @primary blocks at y = floor + 1 flush with the back wall, with 3-4 minecraft:note_block units on top; an L-cap turns south at one end in larger rooms."
    },
    {
      "item": "minecraft:note_block",
      "count": "3..4",
      "rule": "Resting on the instrument bench, one per bench cell; a 4th block sits on the L-cap when the room is wide enough."
    },
    {
      "item": "minecraft:jukebox",
      "count": 1,
      "rule": "Against the west wall, one cell south of the bench, so live music (note_blocks) and recorded music (jukebox) share the same wall."
    },
    {
      "item": "audience_stairs",
      "count": "2..4",
      "rule": "Row of @stairs facing the instrument (facing=north). Centered along x; 2 seats in a 6-wide room, up to 4 in a 12-wide room."
    },
    {
      "item": "minecraft:bookshelf",
      "count": "1..2",
      "rule": "Sheet-music shelf against the east wall; stacked two high when the ceiling permits."
    },
    {
      "item": "minecraft:lantern",
      "count": 2,
      "rule": "Mounted near the lintel: one above the instrument, one above the audience. 'Pools of Light' — no torches."
    },
    {
      "item": "@carpet",
      "count": 1,
      "rule": "Rug under the audience seats, extending one row toward the instrument so it visually connects performer and listeners."
    },
    {
      "item": "minecraft:flower_pot",
      "count": 1,
      "rule": "Decorative pot near the south wall, off the audience axis."
    }
  ],
  "placement_rules": [
    "Instrument against one wall",
    "Audience faces instrument",
    "Soft lighting (lanterns not torches)",
    "Carpet rug under the audience seats, bridging toward the instrument",
    "Jukebox and bookshelf on side walls flanking the bench, never blocking the seating",
    "Beamed lintel ceiling — sound traps, sight stays open"
  ],
  "lighting_ventilation": "Two hanging-style lanterns just below the lintel ('Pools of Light'); the beamed ceiling lets a little daylight seep between beams while still creating an acoustic enclosure (Eating Atmosphere).",
  "style_variants": {
    "medieval": {
      "palette_overrides": {
        "primary": "minecraft:oak_planks",
        "stairs": "minecraft:oak_stairs",
        "carpet": "minecraft:red_carpet"
      },
      "notes": "Warm oak chamber: oak bench piano, red carpet under audience, iron lanterns. Sheet-music bookshelf reads as illuminated manuscripts."
    },
    "modern": {
      "palette_overrides": {
        "primary": "minecraft:smooth_quartz",
        "stairs": "minecraft:smooth_quartz_stairs",
        "carpet": "minecraft:gray_carpet"
      },
      "notes": "Recital studio in smooth quartz and andesite, gray rug, smooth-stone audience seating. The note_blocks read as a sleek synthesiser console."
    },
    "fantasy": {
      "palette_overrides": {
        "primary": "minecraft:dark_oak_planks",
        "stairs": "minecraft:dark_oak_stairs",
        "carpet": "minecraft:purple_carpet"
      },
      "notes": "Dark-oak performance hall, purple carpet, sea-lantern atmosphere. The bookshelf doubles as a tome of enchanted melodies."
    }
  },
  "alexander_patterns_relevant": [
    "eating-atmosphere",
    "pools-of-light",
    "sequence-of-sitting-spaces"
  ],
  "examples": [],
  "tags": {
    "category": "music-room",
    "style": [
      "medieval",
      "modern",
      "fantasy"
    ]
  },
  "python_skill_signature": "pipeline.skills.music_room:build(aabb, materials, style, **kwargs) -> list[Op]",
  "skill_category": "room_role",
  "schema_version": "2.0"
}
