{
  "id": "entry_hall",
  "name": "Entry hall",
  "kind": "room",
  "description": "Formal entrance / foyer that mediates between outside and the rest of the house. Floor in @floor, perimeter walls in @primary with an @accent lintel ring (open ceiling so a roof skill can stack on top). The south wall hosts a 1x2 door OPENING (just air — the door_with_frame skill places the actual door elsewhere). Interior fittings: a 3-tall @fence coat rack crowned by a minecraft:wall_torch (proxy for hanging hooks), a 3-block @stairs sitting bench facing the door, a minecraft:flower_pot on a small @primary pedestal, a @carpet welcome mat at the threshold, and a minecraft:lantern on the wall.",
  "typical_dimensions": {
    "min": [
      4,
      3,
      4
    ],
    "preferred": [
      6,
      4,
      6
    ],
    "max": [
      8,
      5,
      8
    ]
  },
  "required_furniture": [
    {
      "item": "door_opening",
      "count": 1,
      "rule": "1-wide x 2-tall gap in the south wall; never place the door block itself — door_with_frame handles that."
    },
    {
      "item": "coat_rack",
      "count": 1,
      "rule": "3-tall column of @fence against the west interior wall near the door, with a minecraft:wall_torch on top as a hooks proxy."
    },
    {
      "item": "bench",
      "count": 1,
      "rule": "Row of 3 @stairs against the north interior wall, facing south (into the room, toward the door)."
    },
    {
      "item": "minecraft:lantern",
      "count": "1..2",
      "rule": "Mounted near the lintel on the east wall, opposite the coat rack; bigger halls get a second lantern on the west wall for balance."
    },
    {
      "item": "minecraft:flower_pot",
      "count": 1,
      "rule": "Sits on a single @primary pedestal block in the east interior corner near the door, opposite the coat rack."
    },
    {
      "item": "welcome_carpet",
      "count": 1,
      "rule": "Single @carpet block on the floor one cell inside the door opening."
    }
  ],
  "placement_rules": [
    "Bench facing the door",
    "Coat rack on adjacent wall",
    "Welcome carpet at the entrance",
    "Door opening (never an actual door block) centered in the south wall",
    "Flower-pot pedestal in the corner opposite the coat rack so the foyer reads as symmetric",
    "Lantern near the lintel on the wall opposite the coat rack"
  ],
  "lighting_ventilation": "Daylight enters through the door opening; primary interior light is the lantern on the east wall, supported by the wall_torch crowning the coat rack. The open lintel ceiling lets a roof skill cap the hall while allowing the lantern light to wash up the @accent ring.",
  "style_variants": {
    "medieval": {
      "palette_overrides": {
        "primary": "minecraft:oak_planks",
        "accent": "minecraft:stone_bricks",
        "floor": "minecraft:oak_planks",
        "stairs": "minecraft:oak_stairs",
        "fence": "minecraft:oak_fence",
        "carpet": "minecraft:red_carpet"
      },
      "notes": "Heavy oak panelling, stone-brick lintel, red welcome rug, oak fence coat rack with iron wall torch."
    },
    "modern": {
      "palette_overrides": {
        "primary": "minecraft:smooth_quartz",
        "accent": "minecraft:smooth_stone",
        "floor": "minecraft:polished_andesite",
        "stairs": "minecraft:smooth_quartz_stairs",
        "fence": "minecraft:iron_bars",
        "carpet": "minecraft:gray_carpet"
      },
      "notes": "Bright quartz foyer, iron-bar coat rack reading as a minimalist hook stand, gray entry mat, stone bench."
    },
    "fantasy": {
      "palette_overrides": {
        "primary": "minecraft:dark_oak_planks",
        "accent": "minecraft:purpur_block",
        "floor": "minecraft:dark_oak_planks",
        "stairs": "minecraft:dark_oak_stairs",
        "fence": "minecraft:dark_oak_fence",
        "carpet": "minecraft:purple_carpet"
      },
      "notes": "Dark-oak foyer with purpur lintel, dark-oak coat rack and bench, purple welcome rug — fits a wizard's tower or guild hall."
    }
  },
  "alexander_patterns_relevant": [
    "main-entrance",
    "entrance-transition"
  ],
  "examples": [],
  "tags": {
    "category": "entry-hall",
    "style": [
      "medieval",
      "modern",
      "fantasy"
    ]
  },
  "python_skill_signature": "pipeline.skills.entry_hall:build(aabb, materials, style, **kwargs) -> list[Op]",
  "skill_category": "room_role",
  "schema_version": "2.0"
}
